,id,date,time,user_id,username,name,tweet,language,link
249,1611570667912331264,2023-01-07,10:49:23,2606860776,strawbananamilk,ハニ,"@kieminara Iya, emang bule bule ni bacot mulu, ganggu kedamaian fandom",in,https://twitter.com/StrawBananaMilk/status/1611570667912331264
250,1611397013610049537,2023-01-06,23:19:21,257404158,rinikh,Gajah Duduk,"Tapi tetep aja anjrot bule freak, dm lu ganggu :))))))",in,https://twitter.com/riniKH/status/1611397013610049537
251,1611341940796313601,2023-01-06,19:40:30,1521265243871416320,var_g01,Varie_gone,"@cymadawo Ni bule risih njir, ganggu fandom orang. LU TUH GA DIAJAK BEGE, MAU RASIS KE FANDOM SENDIRI NOH. DISINI MAH KITA BERBEDA BEDA TP TETEP SATU. WLE MW KAU KATA LOLICON LAH APA LAH, KUDOAIN BIAR DIARE DI LAMPU MERAH ATAU BAN MELETUS DI JALAN TOL MALEM MALEM",in,https://twitter.com/Var_G01/status/1611341940796313601
252,1611323787131355136,2023-01-06,18:28:22,1137797982886084608,hyyuka_,kei 🌊🌸,Capek sama bule tolol yg gampang ngasih dt gini. Kalau ini ship yang mereka sukain pasti ga dipermasalahin.  Plis gue ga pernah ngamuk mau kek mana pun kapal yang temen gue suka bahkan crack pair sekalipun tapi setidaknya jangan ganggu kesenangan orang lah anjir,in,https://twitter.com/hyyuka_/status/1611323787131355136
253,1611305337029808128,2023-01-06,17:15:03,1014885865699414017,ethereal_kt,°˖✧ kira,aku jg gk suka sm ship yg ada disitu tp yaudah? yang ptg dia gak ganggu tp ofc bule akan sok benar and gay people only😡,in,https://twitter.com/ethereal_kt/status/1611305337029808128
254,1611235944988020738,2023-01-06,12:39:19,1379110019203956738,transonlinetv,Transonlinewach TV,Larangan Taksi Online Ambil Penumpang di Bandara Ganggu Pariwisata di Kota Batam  Aksi viral bule pria yang mendorong troli hingga ke pintu gerbang keluar Bandara Hang Nadim Batam mendapat atensi banyak pihak.  https://t.co/YHXxZDkeyV,in,https://twitter.com/TransonlineTV/status/1611235944988020738
255,1610581641327685635,2023-01-04,17:19:21,267593372,yokl97,YL,@Bammke25 @hazmanha @PSSI Ya itu hasil negosiasi Iwan Bule ke AFF nya. Main Siang agar lebih Aman dan mudah bagi Suporter. Pemain juga waktu istrirahatnya nggak ke ganggu.,in,https://twitter.com/YokL97/status/1610581641327685635
256,1610510817685913601,2023-01-04,12:37:55,1340873824460394496,lbrahimarsy,Arsy,"Ternyata setelah dipikir-pikir, kayanya ada miskomunikasi. Dari tadi gua bilang jangan ganggu pake bahasa indo, lupa kalau doi ini kemungkinan bule 😂 bukan bau kembang tapi bau Chanel",in,https://twitter.com/lbrahimarsy/status/1610510817685913601
257,1609867978966970368,2023-01-02,18:03:30,36052153,nilhaps,nilhaps,"Buku 1/20. Ceritanya sederhana sekali dan gak tebal bukunya. Inti buku ini: jangan ganggu kehidupan di dalam hutan, nanti kamu bakal diganggu juga sama penduduk hutan. Kasian euy macan kumbang jantan. Mati karena ulah bule Amerika. ⭐️3/5.  https://t.co/8wjMc4Ka6d",in,https://twitter.com/nilhaps/status/1609867978966970368
258,1609502257921527808,2023-01-01,17:50:16,980652979152936960,linkhunterxxx,Pemersatu Bangsa,Kakak Iparku Enak Juga Link :  https://t.co/h4BKDvcRjl  Pramugari Prank Tentara Link :  https://t.co/EOFgZjKNhC  Istri Dicrotin Temanku Link :  https://t.co/JWbrgrkQFg  Ganggu Pacar Lagi Belajar  Link :  https://t.co/bUI4pqhDSB  Cewek Bule Di Bali Link :  https://t.co/S2B4ZUI1Hs,in,https://twitter.com/linkhunterxxx/status/1609502257921527808
259,1609059095348412417,2022-12-31,12:29:17,3067131289,adi_rossoneri,Adi kolak pisang,@PRFMnews Bule ini tidak menghargai budaya kita. Jangan ganggu budaya kami yang suka buang sampah sembarangan  https://t.co/IbnPPQ1yHE,in,https://twitter.com/adi_rossoneri/status/1609059095348412417
260,1608412095464472576,2022-12-29,17:38:21,1538030172452007936,bule_glen,glen bule,@vonnycornellya_ Aduh ganggu ini,in,https://twitter.com/bule_glen/status/1608412095464472576
261,1608373591535661058,2022-12-29,15:05:21,1181506000144101376,saustiram8,Selerakeluarga,@vocketfcID 1.mau mecah voter antar provinsi biar keliatan siapa lawan siapa kawan  2. Motif nyalon lagi iwan bule 3. Mau nendang sekjend dri pssi  4. Mau manasin kondisi menjelang kongres 5. Ganggu kursi calon biar gabanyak calon  Semua banyak motifnya. Makanya kita gabisa sepihak.,in,https://twitter.com/saustiram8/status/1608373591535661058
262,1606801813407432706,2022-12-25,06:59:39,1193831804232335360,novembev,𐐪 cнa : hiatus 𐑂,"@yanzero_ @tanyarlfes valid, aku tinggal bareng bule di salah satu rumah kantor yang kata tetangga udah kosong 5-10 tahun. selama bulenya tinggal disini gak ada gangguan. eh pas bulenya balik ke kampung, aku di ganggu trus sama ""penghuni"" disini",in,https://twitter.com/novembev/status/1606801813407432706
263,1606495209302675456,2022-12-24,10:41:19,1431436223176798209,alifsygdelnes,lifyy,"apaansi bule udh 3x salah ngetok kamar. tiap dibuka ""im so sorry"" berak. bokap sampe turun tangan. i mean apasi salah mulu, konsep lu sengaja apa gmn anj ganggu tau ga",in,https://twitter.com/alifsygdelnes/status/1606495209302675456
264,1605838581611872256,2022-12-22,15:12:07,278427396,nee_yoga,ys,@sandiuno Bisa nggak tuh bule dicekal ato diblacklist aja di Indonesia biar gak ganggu pariwisata 😒,in,https://twitter.com/nee_yoga/status/1605838581611872256
265,1605769690965426177,2022-12-22,10:38:22,1464216869787869197,killyourid0l,hannah baker clkwn,@iaabg_ @humanintrash Wkwk dari pada ganggu yah gmn ya kan bule yg kena bom nya,in,https://twitter.com/killyourid0l/status/1605769690965426177
266,1603659643330650112,2022-12-16,14:53:48,1533385113597202432,ranlysm,rann• @ after dm.,auto block aja kak😭👍🏻jujur ganggu bgt tuh bule,in,https://twitter.com/ranlysm/status/1603659643330650112
267,1602610068733808640,2022-12-13,17:23:10,1251061782065475585,sug_xbbry,𝚝𝚊𝚎𝚗𝚊 🐯,"@llemonadeee_ Kulit² bule itu yg kek mana anjir 🥲, tapi selagi gak ganggu mah biarin aja dlu kali mungkin aja ntar ilang",in,https://twitter.com/sug_xbbry/status/1602610068733808640
268,1601738645949812736,2022-12-11,07:40:26,1093961130,bbonoyya,Boni,"@tanyarlfes trus si bule nyautin ""dih gw mah ga bau, lu kali tuh bau"", terus dibales ""yakali gw bau, gw mah pake rexona hihhh sorry ya"" agak tolil emg nih tmn gw yg ceplas ceplos, ngomongnya kenceng bgt mana banyak org😭. kasian sih si bule malu tp klo ga digituin tiap hari ganggu bgt baunya",in,https://twitter.com/bbonoyya/status/1601738645949812736
269,1601440459670179840,2022-12-10,11:55:33,1564951543668809728,jeffreysnoona,pacar bapak lo,"lagian kalo emang dia ngomong inggris cmn buat gaya gayaan knp?? gua tau mungkin lo ngerasa ke ganggu sama itu, tapi lo ga harus ngata ngatain dia sok inggris, sok bule, masih pake translate google sok bgt",in,https://twitter.com/Jeffreysnoona/status/1601440459670179840
270,1601257024817618944,2022-12-09,23:46:39,235069572,youonev,antomi,"(-) Beberapa hal yang rada ganggu tuh latar sekolah ""negeri""-nya Lisa/Sarah yang gak match sama background ekonomi mereka WAKAK. ""Bule kere"" dan ""Coba aja bunda gue masih ada, pasti gue udah pindah"" kayaknya dijadiin justifikasi tapi tetep ora masuk.",in,https://twitter.com/youonev/status/1601257024817618944
271,1600869156814888960,2022-12-08,22:05:24,1395260223099604995,sehunaw2,Sehunaw,@Askrlfess Kalian ga takut apa nanti jadi dampak buruk? Kaya liat sekarang cewe indo pengen banget dapet laki bule? Dengan ini bisa mem filter laki mana ya g mokondo mana yang dia milikku bukan milikmu dia untukku bukan untuk mu pergilah kamu jangan kau ganggu biar kan aku mendekatinya,in,https://twitter.com/Sehunaw2/status/1600869156814888960
272,1642591184064495618,2023-04-03,01:13:50,1098218714527223808,simpanse15,Rrrrlllvv,kontolll jauh amat anjing tipe nya bule bangsat,in,https://twitter.com/Simpanse15/status/1642591184064495618
273,1642532075596292097,2023-04-02,21:18:58,3248886918,wrahardian2,wrahardian,@CNNIndonesia baiknya turis bule yg kedapatan makan minum di siang hari juga di deportasi agar mereka hormat dan  takut pada ketegasan bangsa kita,in,https://twitter.com/wrahardian2/status/1642532075596292097
274,1642492212029300737,2023-04-02,18:40:34,1311313121542250499,diposurop,Bekatik 🇲🇨,@VartbroSeafarer Hahahahaha.... Si bule keturunan pelarian bangsa yaman cemen yg leluhurnya kabur buat jualan dongeng budaya abad ke 7 di indonesia...😂,in,https://twitter.com/DiposuroP/status/1642492212029300737
275,1642389745639763971,2023-04-02,11:53:24,949930017898708992,calon_koki,Artis Gorengan📶,@PDemokrat Bapakmu pernah menukar harga diri bangsa ini hanya gara gara bule pengedar narkoba.,in,https://twitter.com/calon_koki/status/1642389745639763971
276,1642344332618530816,2023-04-02,08:52:56,1622073476076171265,bujangp34336452,Bujang.Palala,dirumah sendiripun kita diminta harus nurut bule yg datang jauh. segitu rendahnya bangsa ini dimata bule,in,https://twitter.com/BujangP34336452/status/1642344332618530816
277,1642253672762716160,2023-04-02,02:52:41,1603597312982650880,gahana5150,Wandi Irawan,"@6undul0h Miris Itu bule berasal dr negara yg prnh jd Penjajah no 1 dunia, tp peduli sm nasib bangsa yg dijajah.  Di kita jelas2 termaktub dlm UUD, &amp; soal Israel ada  PERMENLU nya ga bs tampil disini bawa2 atribut negara mereka, tp yg pd ngaku WNI malah dukung dgn alasan olahraga.  KOPET",in,https://twitter.com/gahana5150/status/1642253672762716160
278,1642081778734366720,2023-04-01,15:29:39,3016913242,lezathe,bule caliburn,@ciggaretsr @tawajayuk @tinvkah GUNANYA APA BANGSAT?😭😭😭😭😭,in,https://twitter.com/lezathe/status/1642081778734366720
279,1642079745730048001,2023-04-01,15:21:34,1546166891600760832,ciggaretsr,barat komting wood,@tinvkah @lezathe @tawajayuk ajg gua bayangin gimana rasanya jd bule punya anak 11 semuanya mirip bono kelakuannya bangsat,in,https://twitter.com/ciggaretsr/status/1642079745730048001
280,1641984254702944256,2023-04-01,09:02:07,2902552405,wisnuw2019,jinjanjun,"@Paltiwest bukan cuma golongan kaum muslim aja sih di Kristen juga ada  Di Islam orang"" menganggap keturunan Rasulullah sangar mulia  Di Kristen orang anggap bangsa Israel bangsa yang di berkati Allah  Emang bangsa ini aja yg goblok ada bule aja minta foto",in,https://twitter.com/wisnuw2019/status/1641984254702944256
281,1641978676215697408,2023-04-01,08:39:57,1605887029807439872,sutantobule,Sutanto Bule,@Dennysiregar7 @AngkasaPura_2 Memalukan bangsa Indonesia.. Ingat lah bangsa Indonesia lebih beradab daripada bangsa-bangsa lain,in,https://twitter.com/SutantoBule/status/1641978676215697408
282,1641768414325923847,2023-03-31,18:44:27,1351895218916782081,kaiuhu1,Ninu Ninu,@Nugroho_Hami @fauzanhakim97 Postingan bule dan screen shot WA lbh dipercaya drpd postingan FIFA sendiri 😂 berat ya bangsa ini. Pantesan mudah diadu domba. Yg dipercaya bukan yg benar tp yg sesuai dengan narasinya sendiri.,in,https://twitter.com/kaiuhu1/status/1641768414325923847
283,1641762278965137408,2023-03-31,18:20:04,99034157,hend_85,Singa Petualang,"@albertsamuel28 @KomnasHAM Apa yg membedakan sipil dan TERORIS PAPUA...? Saya yakin TNI propesional memberantas TERORIS papua.. Kalau TERORIS PAPUA murni berjuang utk kemerdekaan, itu bule yg disandra sdhh kalianbunuh seperti membunuh ssma anak bangsa... Tapi ini tidak, karena kalian berjuang demi asing..",in,https://twitter.com/hend_85/status/1641762278965137408
284,1641644279461453826,2023-03-31,10:31:11,1500901842477191168,harumjoshua,Joshua Harum Tanoso,"@Kim_____1992 @yudhiyustira22 @theeonme @Jhonkosmik Aku bantu jelaskan ya.. Jadi walaupun sama sama bule, tapi Russia itu bangsa Slavic. Sementara Israel kan anak emasnya bangsa kulit putih, maka peraturan untuk bangsa kulit putih tentu tidak bisa disamakan dengan bangsa lainnya..",in,https://twitter.com/HarumJoshua/status/1641644279461453826
285,1641592592965181440,2023-03-31,07:05:48,1198400601517748224,nusantara_one,Gadjah Mada,Terima kasih Iwan Bule telah berikan penghiburan dan semangat kepada Timnas Garuda U 20  Sepak bola cara pintas anak bangsa menjadi milyarder dengan cara legal. Negara akan dapat banyak pajak dari sana  https://t.co/mMbGZNemY5,in,https://twitter.com/nusantara_one/status/1641592592965181440
286,1641501669094752256,2023-03-31,01:04:30,97746659,linda_gunawan,linda,"@kurawa Orang satu ini memang bajingan bangsat. Dia pengen pildun tetap main, tapi Israel dicoret. Dia lebih seneng ngurusi Israel dibanding ngurusin Bali yang dijajah Bule norak.",in,https://twitter.com/linda_gunawan/status/1641501669094752256
287,1641499413519687681,2023-03-31,00:55:32,97746659,linda_gunawan,linda,"@idextratime Bajingan bangsat ini orang. Bukannya ngurus Bule ngerusak Bali, malah ngurusi Israel.",in,https://twitter.com/linda_gunawan/status/1641499413519687681
288,1641474723094872065,2023-03-30,23:17:25,3016913242,lezathe,bule caliburn,"@timbfal besok lu bakal lebih happy bacot anjing kontol bangsat ngentot peler puki, diem.",in,https://twitter.com/lezathe/status/1641474723094872065
289,1641438177318817793,2023-03-30,20:52:12,1549682387264864256,acctsuspnded,F U Double Standard FIFA,"@NoKadrun @zhouchean11 @pengarang_sajak Indonesia sedang dipandang negatif di dunia intl, bknnya meredakan collateral, malah ikut menjelek2an bangsa sndr. sok2an pake istilah2 gaul internet anak bule. KnTL.  Setipis sepakbola aja kah patriotisme lu? Kalopun mmng negara fcked up penyelenggaraan WC trs g lu maafkan,gitu?",in,https://twitter.com/AcctSuspnded/status/1641438177318817793
290,1641436204444028931,2023-03-30,20:44:22,1549682387264864256,acctsuspnded,F U Double Standard FIFA,"@NoKadrun @zhouchean11 @pengarang_sajak Lu yg stupid. Sok cebong kadrun, cuma diban bule langsung tantrum menghina bangsa sendiri.   Presiden ama PSSI udah jamin keamanan, dalam hitungan jam kita di ban.  Lu ngamuk kayak bocah sekana2 Indonesia cuma bola?  Nggak usah ngaku Indonesia lo. B4ngsat.",in,https://twitter.com/AcctSuspnded/status/1641436204444028931
291,1641431942473322499,2023-03-30,20:27:26,753553855,_haye_,Haye Targaryen,Harusnya kan bersyukur saja bahwa FIFA memilih menutup hura huranya dengan bahasa paling sopan. Dengan sengaja dibiarkan Indonesia menimbang dan mengukur sendiri dimana kekurangan kita tanpa harus dituding bule bule.   Berterima kasih bahwa busuknya bangsa ini masih diperban.,in,https://twitter.com/_haye_/status/1641431942473322499
292,1641405725976195074,2023-03-30,18:43:15,968320580,blxccswxnn,Killua Protector,Oh iya belum lg bule td yg hampir nabrak aku di lampu merah gara2 dy nerobos. Aku sampe teriak BULE BANGSAT di jalan,in,https://twitter.com/blxccswxnn/status/1641405725976195074
293,1641379353564160001,2023-03-30,16:58:27,467125674,oot_bule,Brandal_Kelana,"@benwaee_ @SiaranBolaLive Bukan ancur karena ulahnya sendiri, tapi hancur oleh oramaslah yang demo dan menteror, wah melimpahkan kesalahan sama bangsa, ngopi cuy..",in,https://twitter.com/oot_bule/status/1641379353564160001
294,1641289031760879616,2023-03-30,10:59:33,1746818690,quisestnrd,-(∞) ⬛🟩,"@tanyakanrl ""Terus kita patut bangga dengan pujian orang-orang luar? Apa kita harus selalunya muja-muja bule, nurut apa kata bule, ngejilatin p– mereka terus? Liat tuh, kandas mimpi anak-anak orang yang pengen mengharumkan nama bangsa di kancah global!""",in,https://twitter.com/QuisEstNRD/status/1641289031760879616
295,1641285843754295297,2023-03-30,10:46:53,1361621223961108481,bukanbayibiasaa,Rayyanjay,@Heriitsvirgo1 @snugakrunk @detikcom @detikbali_ ya susah kalo gitu namanya orang susah diprediksi bro wkwk lagian fenomena bule bangsat ke bali baru baru ini,in,https://twitter.com/bukanbayibiasaa/status/1641285843754295297
296,1641252875719561216,2023-03-30,08:35:53,1535456110651420672,triviena1,Tri Viena,Dukungan Anies pada politik identitas bukan ermian seorang contoh negarawan yang baik bagi Indonesia karena sikapnya bisa merusak kerukunan bangsa  BREAKING NEWS TAMBAH LUCU Kanjuruhan Puas FIFA Israel Palestina Bali Iwan Bule Qatar Mahfud Hokky Pak Erick Kyuhyun Lebay #LISA  https://t.co/6A8mZapGBN,in,https://twitter.com/TriViena1/status/1641252875719561216
297,1641245766080675840,2023-03-30,08:07:38,1263789338111827970,erabaru19,Adi Pemoengkaz,"Dan dari kasus U20 ini, Sy kok ga percaya bangsa ini pernah dijajah negara bule 350th. Kemungkinannya, yg menjajah itu bangsa kita sendiri. Orang Bule diajak masuk dan diajak turut campur oleh penguasa² nusantara waktu itu. Dan skr dijajah para koruptor kakap. Maaf kalo keliru🙏",in,https://twitter.com/EraBaru19/status/1641245766080675840
298,1641189901126488064,2023-03-30,04:25:38,1222076785736601600,yudiwhy_,whyme,"Solidaritas boleh tapi ga usah membunuh mimpi anak bangsa juga dong, kasian mereka udah persiapan dari 2020. Heran aja bule bule yang datang ga ngehargain budaya lu masih lu bela di bilang ga usah di viral in ,ini orang mau main bola lu larang. Sekali lagi saya benci negara saya",in,https://twitter.com/yudiwhy_/status/1641189901126488064
299,1641167342544748547,2023-03-30,02:56:00,1276880272315674625,cetilcetot,black,Kok ada bule nya ya? Emang yg bule itu anak bangsa mana?,in,https://twitter.com/cetilcetot/status/1641167342544748547
300,1641107651932336128,2023-03-29,22:58:49,1393363555416633347,om_abduel,Abdul lah,"@txtdarisisange Fifa ajang bergengsi bisa bikin naik nama indonesia di mata internasional, mikirin israel palestina, macem tuh orang pada mikirin kita di indonesia aja. Harusnya bangga indo dikenal internasional, ga bosen lu pd muja bule, arab, korea mulu? Kali2 bangga sama bangsa sendiri maszeh",in,https://twitter.com/om_abduel/status/1641107651932336128
301,1640899220910800897,2023-03-29,09:10:35,1602114436831285248,thegeje,Express999,@keuangannews_id Keturunan bule asal jadi WNI mereka juga orang Indonesia. Pernyataan gini ni yg rasis memecah belah bangsa,in,https://twitter.com/thegeje/status/1640899220910800897
302,1640887313092988928,2023-03-29,08:23:16,354694746,haipanjiishere,panji is here,@OnlyFrens mimpi anak bangsa keturunan Bule adalah membela tim nasional medioker. 🤲🏽,in,https://twitter.com/haipanjiishere/status/1640887313092988928
303,1640880966817427456,2023-03-29,07:58:03,1603997349696917531,rdprasetyo_a,rdprasetyo adhi,"@BugBunny1076 Salaah satu warisan kolonialisme yg masih sangat terasa adalah inferioritas thd orang asing ( bule, arab dsb ). Khususon arab, karena satu bangsa dg nabi muhamad, maka diberikan tmp istimewa dlm strata sosial kita. Ayo, kita tidak lebih jelek dan tdk lebih baik. SAMA....",in,https://twitter.com/rdprasetyo_a/status/1640880966817427456
304,1640867626036645889,2023-03-29,07:05:02,1142030368742133760,onlyfrens,Tanjidin,Itu 4 bule mimpi anak bangsa mana?,in,https://twitter.com/OnlyFrens/status/1640867626036645889
305,1640721091428769793,2023-03-28,21:22:45,969993558,goenawangn,GoeN,"@ALTAismyname @kurawa Agree, saya tidak menganggap semua bule bangsat, saya lebih menyoroti bhumiputera yg inferior dan menganggap apapun yg berbau bule selalu wow",in,https://twitter.com/goenawangn/status/1640721091428769793
306,1640712477293051908,2023-03-28,20:48:32,1550213758470868992,mattarmizi4,IWAN BULE,@littlerizh @idextratime sok sokan jaga amanat pendiri bangsa. ngocok aje lu di air air bapak tua boomer kolot @knpiharis,in,https://twitter.com/MATTARMIZI4/status/1640712477293051908
307,1640696571242094599,2023-03-28,19:45:19,1550213758470868992,mattarmizi4,IWAN BULE,@ganjarpranowo bacod lo gubernur perusak mimpi anak bangsa! semoga keturunanmu semua tidak punya mimpi. dan selamanya akan makan uang haram,in,https://twitter.com/MATTARMIZI4/status/1640696571242094599
308,1640678126366920704,2023-03-28,18:32:02,1086240739095306240,jeleiws,jë💙🤍,Lrt BULE TOLOL BANGSAT NGAKAK,in,https://twitter.com/jeleiws/status/1640678126366920704
309,1640664831656357888,2023-03-28,17:39:12,1388179588895838208,skeeletonz,deo hexos,@lezathe bangsat lu bule,in,https://twitter.com/skeeletonz/status/1640664831656357888
310,1640644059755843584,2023-03-28,16:16:40,404529706,alunk_bule,#YaAllohlindungiNegeriKu,Kanjuruhan brapa anak bangsa mati sia2 ente mingkem ......,in,https://twitter.com/Alunk_bule/status/1640644059755843584
311,1640639216215523329,2023-03-28,15:57:25,2576659201,irvanhn_,.,"@GOAL_ID Pas 135 nyawa anak bangsa mimpi-mimpinya menguap bersama gas air mata di Kanjuruhan kalian para pemain timnas malah pilih rame-rame bilang ""ketum bule terbaik"". Giliran terancam gagal main di Pildun U20 rame-rame ngomongin mimpi anak bangsa, kocak",in,https://twitter.com/IrvanHN_/status/1640639216215523329
312,1640609824961622016,2023-03-28,14:00:37,1220005315346743301,kmendaen,af,"@FaktaSepakbola Demi nyindir fifa karena Rusia, kita rela mengubur mimpi anak bangsa. Demi bule kita rela matiin mimpi anak bangsa.",in,https://twitter.com/kmendaen/status/1640609824961622016
313,1640554190123442179,2023-03-28,10:19:33,1499413919387234304,calon_gadunid,Bitter Daddy,"Barusan ribut sama bule muscle di gym karena orangnya ga ada manner sama sekali. Alat lagi kosong di klaim punya dia, udah gitu pas diriku lagi main alat yang lain, eh mau diklaim juga. Bangsat emang",in,https://twitter.com/calon_gadunid/status/1640554190123442179
314,1640492269923868673,2023-03-28,06:13:30,1605887029807439872,sutantobule,Sutanto Bule,@Dennysiregar7 Mau2 nya jadi keset bangsa lain ..,in,https://twitter.com/SutantoBule/status/1640492269923868673
315,1640478573403471873,2023-03-28,05:19:05,1516816199413559296,allya_kristy,allya,@Afeir @Indones1aku ANAKNYA bule jg😂😂😂akal sehat sdh musnah ini orang 2 kasian bgt Masa depan anak bangsa,in,https://twitter.com/Allya_Kristy/status/1640478573403471873
316,1640382163429253120,2023-03-27,22:55:59,1430337231781310474,flatadjang,Farid Maruf Latadjang,"@ekowboy2 Yang jelas bukan Bangsa Kau Ko, klo kau pernah ke jazirah kau akan tau persis siapa dan apa itu Palestine, mereka sangat rasis  jangankan Bule atau kita ras Asia sesama arab saja mereka anggap budak belian,negara2 di sekeliling Palestine yg Islam dan kaya2 aja ogah bantu mereka",in,https://twitter.com/FLatadjang/status/1640382163429253120
317,1640374072289775617,2023-03-27,22:23:50,421762533,laperbacot,ok,"Seharusnya kita bersatu, lihatlah kita udh bagian dari G20, harusnya kita makin semangat buat jadi G5. Masa mau terpecah belah terus cuma gara2 agama. Nenek moyang kita udh bangun candi dari 750 AC ketika org2 bule masih jadi viking. Jangan mau diperbudak sama bangsa lain!!!!",in,https://twitter.com/laperbacot/status/1640374072289775617
318,1640355000940654593,2023-03-27,21:08:03,223133363,lazymusprime,Raja Ribu Jaya,"Setelah nge-bully Iwan Bule karena menjadikan posisi ketum PSSI sebagai batu loncatan politik, netijen kini mendukung sang ketum pengganti memperjuangkan ajang olahraga yang bakal jadi sarana kampanye sang ketum baru, sembari teriak jangan campur politik dengan olahraga. Bangsat!",in,https://twitter.com/LazymusPrime/status/1640355000940654593
319,1640325901069213697,2023-03-27,19:12:25,747681569494732800,lucky_hafner,lucky,@Tita83079013 @ganjarpranowo @PDI_Perjuangan @PKSejahtera Setau kita hari ini bahwa bangsa palestina itu sebagian muslim sebagian lagi kristen bahkan istri yaser arafat pemimpin PLO cewe bule inggris ..perang merrka bukan perang agama perang berebut tanah warisan leluhurnya yaitu ibrahim ...aneh disini ko umat islam ditarik2 .,in,https://twitter.com/lucky_hafner/status/1640325901069213697
320,1640259257307381760,2023-03-27,14:47:36,1076886191117500416,sikumbanglibra,AQUA,"@BosPurwa Adakah orang2 jokowi yg secerdas bule ini... andai saja semua org2 nya secerdas bule ini, dah maju bangsa ini, sejak 10th terakhir.",in,https://twitter.com/Sikumbanglibra/status/1640259257307381760
321,1640223880366419968,2023-03-27,12:27:01,465356974,aditya_putra30,Kim Jong-Os,Bangsa pejuang  Pejuang dr mn klo liat bule nyoba nasgor pd overproud sampe sinting 🤭🤭  Get some help biar kepala lu ga cm hiasan 🤣🤣,in,https://twitter.com/aditya_putra30/status/1640223880366419968
322,1640186577933713408,2023-03-27,09:58:48,69155840,ganitri,Satvika Ganitri,Fokus ke video-nya..tumben diriku setuju sama omongan Bule 🥲  Pak @sandiuno jangan 'jual' Pulau Bali kami sebagai pulau murah lah Pak..harga diri bangsa dan negara lo ini..pusing kami liat kelakuan bule bule 'murah' disini,in,https://twitter.com/ganitri/status/1640186577933713408
323,1640165590064316416,2023-03-27,08:35:24,564316374,yonsastra,YON•전량,Dibilang bocorkan data ke pemerintah China...tp aslinya..versi simplenya...tiktok 3x lipat diminati drpd IG FB dan juga Utub (app milik amrik)..tp politikus amrik disuruh cari gara2 di srh sabotase. Itulah bule. Dari dulu otak bule USA bangsat semuanya. Gak bisa dipercaya bos!  https://t.co/KjzQZEQRdY,in,https://twitter.com/yonsastra/status/1640165590064316416
324,1640147692377759744,2023-03-27,07:24:16,782155982138777600,dana_politik,Dana Individu,"Gubernur Bali ngurus Bule miskin yg resek aja kewalahan, sok mau ngurusin Timnas Israel.. nanti turis kaya pada gak mau liburan ke Bali lg lebih kewalahan tuh, ingat Israel itu bangsa Pilihan..🤣",in,https://twitter.com/dana_politik/status/1640147692377759744
325,1640021797423972353,2023-03-26,23:04:01,1551723709001768960,kpktemananies,Am_Bjorkan,di sekitaran tmpt tinggal bajingan bule itu kyk-nya memang jauh dari KANTOR POLISI atw malah mgkn emg GAK ADA POLISI di daerah situ  mky si bangsat bule kencleng bisa terus bebas berbuat semau-nya..  (..tapi kalopun ada emg brani masalahin si bule bangsat ?)  😜,in,https://twitter.com/kpktemananies/status/1640021797423972353
326,1639972599857033217,2023-03-26,19:48:31,1568823857288728576,pinjolbiadab,KONTOL SAKTI,@kurawa Woi bangsat otak kau cam kontol ya Kau kira bali bule nya miskin? Ronaldo aja pernah kesana sampah masyarakat kayak lu bisa di beli ama orang bali asal nguap aja lu njeng,in,https://twitter.com/PINJOLBIADAB/status/1639972599857033217
